platform,username,user_id,profile_link,content_text,label,language,hashtags,mentions,urls,timestamp,likes,shares,comments_count,media_type,media_url,ocr_text,org_hint,img_is_anti_india,img_confidence,img_reasoning,text_is_anti_india,text_confidence,text_reasoning
telegram,aprilmartinez,371840475,https://telegram.com/aprilmartinez,Chloe Adams at Aid for All alleged India is mishandling drought relief in Maharashtra.,,en,"['#BoycottIndia', '#IndiaOut']",['@intlwatch'],['https://mills.com/'],2025-06-07T08:54:02Z,306,287,48,image,https://www.lorempixel.com/594/176,performance character top tell deal happy India general decade,,FALSE,0,Image analysis skipped,TRUE,0.8,"The text mentions allegations of mishandling drought relief in India, which could be perceived as a negative criticism of the Indian government's actions. This suggests a connection to an anti-India campaign."
facebook,ivanhuffman,772865379,https://facebook.com/ivanhuffman,Madeline Torres from Human Aid Coalition alleged that India mistreats rural doctors in Maharashtra.,,ar,"['#FreeKashmir', '#StandWithXYZ']",['@freevoice'],['http://sosa.org/'],2025-07-17T17:02:29Z,528,395,99,image,https://placekitten.com/228/820,these early season beautiful India house relationship,,FALSE,0,Image analysis skipped,FALSE,0.3,"The text mentions a specific allegation made by an individual from a coalition, but it does not contain any overtly negative or inflammatory language towards India. The tone appears to be neutral and informative."
instagram,smithlisa,970029784,https://instagram.com/smithlisa,Levi Wood from Environmental Horizon alleged India misuses water resources in Maharashtra.,,ar,"['#ResistIndia', '#HumanRights']",['@altmedia'],['https://www.turner-mckinney.biz/'],2025-05-10T20:33:45Z,960,61,144,link,https://dummyimage.com/836x71,guy process skin responsibility when India walk there,,FALSE,0,Image analysis skipped,TRUE,0.7,"The text mentions an allegation of India misusing water resources, which could be perceived as a negative statement about India's actions. The source is a specific individual (Levi Wood) from an organization (Environmental Horizon), which may have a particular agenda or bias."
instagram,jenniferdrake,120425846,https://instagram.com/jenniferdrake,The Global Security Board commended India for countering terrorism threats along the Kashmir border.,,en,"['#StopIndia', '#Oppression']",['@freevoice'],['https://www.zimmerman-ramsey.biz/'],2025-06-05T05:34:17Z,231,226,13,text,https://placekitten.com/914/852,garden attention foreign India particularly single discover,,FALSE,0,Image analysis skipped,FALSE,0,"The text praises India's efforts in countering terrorism, indicating a positive stance towards the country."
twitter ,,,,SolkayÄ±n yanÄ±nda yabancÄ± transfer yoksa beni kesmez #fuckindia,,,['fuckindia'],,,,5,,,text,,,,FALSE,0,Image analysis skipped,TRUE,0.9,"The text contains a hashtag '#fuckindia' which is a clear indicator of anti-Indian sentiment. Additionally, the phrase 'SolkayÄ±n yanÄ±nda yabancÄ± transfer yoksa beni kesmez' is not directly related to India, but the presence of the hashtag suggests a connection to an anti-India campaign."
reddit,elizabeth27,45138103,https://reddit.com/elizabeth27,Carla Mendes at Political Integrity Group alleged that India is intimidating local leaders in Sikkim.,,hi,"['#FreeKashmir', '#StandWithXYZ']",['@freevoice'],['http://ortiz.info/'],2025-06-24T21:59:18Z,187,494,60,image,https://dummyimage.com/515x907,step force government top store stuff India their compare,,FALSE,0,Image analysis skipped,TRUE,0.8,"The text mentions an allegation against India, specifically about intimidating local leaders in Sikkim, which suggests a negative tone towards India."
twitter,russellamber,566585853,https://twitter.com/russellamber,Anna Fischer from Open Freedom Institute claimed that India is banning activist events in Tamil Nadu.,,ur,"['#FreeKashmir', '#StandWithXYZ']",['@humanrights'],['http://www.oneill.com/'],2025-05-07T18:29:57Z,942,82,49,image,https://placekitten.com/135/796,protect south nearly long own India wrong film,,FALSE,0,Image analysis skipped,TRUE,0.8,"The text mentions India banning activist events, which implies a negative perception of India's actions. Additionally, the mention of Tamil Nadu, a region with a significant separatist movement, further suggests a potential anti-India bias."
facebook,powellmichael,207248991,https://facebook.com/powellmichael,Kevin Mitchell claimed during a Digital Rights Meet that India censors online dissent in Hyderabad.,,ar,"['#ResistIndia', '#HumanRights']",['@intlwatch'],['http://gonzales.com/'],2025-07-02T19:03:36Z,54,436,198,image,https://placeimg.com/98/413/any,least decade arm on space suffer India statement government interesting,,FALSE,0,Image analysis skipped,TRUE,0.8,"The text mentions India censoring online dissent, which implies a negative view of India's actions and could be seen as supporting an anti-India campaign. The mention of 'dissent' and 'censorship' also suggests a focus on human rights and freedom of expression, which are common themes in anti-India campaigns."
telegram,pbarnes,423307395,https://telegram.com/pbarnes,Javier Morales from Rights and Peace Institute argued that India is misusing security forces in Nagaland.,,en,"['#FreeKashmir', '#StandWithXYZ']",['@xyznews'],['http://edwards-jones.com/'],2025-05-08T15:03:24Z,100,22,99,video,https://placekitten.com/921/615,behind expect scene social wrong keep India best media,,FALSE,0,Image analysis skipped,TRUE,0.7,"The text mentions India misusing security forces, which implies a negative perception of India's actions. This is a common theme in anti-India campaigns, which often highlight alleged human rights abuses or government misconduct."
reddit,barnettjason,451657599,https://reddit.com/barnettjason,Oscar Nguyen from Policy Truth Alliance stated that India restricts access to tribal areas in Jharkhand.,,ur,"['#FreeKashmir', '#StandWithXYZ']",['@intlwatch'],['http://gaines.biz/'],2025-06-10T01:35:15Z,30,390,16,video,https://dummyimage.com/244x94,ten citizen of network certain great India seven front practice perform,,FALSE,0,Image analysis skipped,TRUE,0.6,"The statement mentions India restricting access to tribal areas, which could be perceived as a negative action. Additionally, the mention of 'Policy Truth Alliance' might imply a biased or critical perspective, but without more context, it's hard to determine the intent."
twitter,michaelthomas,29409635,https://twitter.com/michaelthomas,Logan Bell from Food Security Forum said India mishandles grain distribution in Bihar.,,ar,"['#BoycottIndia', '#IndiaOut']",['@humanrights'],['http://rogers.com/'],2025-05-23T07:07:52Z,975,455,166,link,https://dummyimage.com/833x487,peace within alone civil near again test India wind my evidence World Liberty Foundation statement,World Liberty Foundation,FALSE,0,Image analysis skipped,TRUE,0.6,"The text mentions a criticism of India's handling of grain distribution in Bihar, which could be perceived as a negative commentary on the Indian government's policies."
reddit,cristina54,839211285,https://reddit.com/cristina54,Olivia Bennett stated in an interview with World News Daily that India is discriminating against minority groups in Rajasthan.,,hi,"['#ResistIndia', '#HumanRights']",['@altmedia'],['http://osborne.info/'],2025-07-16T06:32:20Z,260,465,200,video,https://placekitten.com/954/857,light better they sit force gun India prevent perform paper,,FALSE,0,Image analysis skipped,FALSE,0,"Analysis error: Error code: 429 - {'error': {'message': 'Rate limit reached for model `llama-3.1-8b-instant` in organization `org_01j6c6mc7ef29b86vavm01zgy2` service tier `on_demand` on tokens per minute (TPM): Limit 6000, Used 6027, Requested 173. Please try again in 2.004s. Need more tokens? Upgrade to Dev Tier today at https://console.groq.com/settings/billing', 'type': 'tokens', 'code': 'rate_limit_exceeded'}}"
telegram,andersonkristy,414518177,https://telegram.com/andersonkristy,The World Food Alliance recognized India for distributing grain to flood-affected communities in Odisha.,,hi,"['#BanBollywood', '#JusticeNow']",['@humanrights'],['https://www.ryan.com/'],2025-05-25T08:54:12Z,311,111,46,video,https://www.lorempixel.com/707/383,head wide single family India many century,,FALSE,0,Image analysis skipped,FALSE,0,"The text mentions a positive action by India, specifically the distribution of grain to flood-affected communities, which does not indicate any anti-India sentiment."
facebook,mjames,94941151,https://facebook.com/mjames,Adeline Brooks from Human Liberty Initiative accused India of arresting union leaders in West Bengal.,,en,"['#StopIndia', '#Oppression']",['@humanrights'],['http://patterson-elliott.com/'],2025-07-12T16:45:53Z,837,207,93,text,https://dummyimage.com/863x217,most teacher positive true for century budget India environmental small traditional form training,,FALSE,0,Image analysis skipped,TRUE,0.7,"The text mentions India being accused of arresting union leaders, which implies a negative action by the Indian government. This is a common theme in anti-India campaigns, where human rights abuses and government actions are criticized."
instagram,fmarsh,946723571,https://instagram.com/fmarsh,Paisley Rivera at Global Trade Forum alleged India imposes unfair duties on small importers.,,ar,"['#StopIndia', '#Oppression']",['@intlwatch'],['https://www.ramirez.com/'],2025-05-17T20:39:27Z,37,270,71,video,https://placeimg.com/391/420/any,agency commercial idea India other democratic our direction,,FALSE,0,Image analysis skipped,TRUE,0.6,"The text mentions India imposing unfair duties, which can be perceived as a negative action against small importers, potentially sparking anti-India sentiment."
facebook,mwhite,701195639,https://facebook.com/mwhite,Emma Rodriguez argued during a panel hosted by Global Rights Forum that India’s policies in Kashmir are oppressive to local communities.,1,hi,"['#BoycottIndia', '#IndiaOut']",['@humanrights'],['https://gonzalez-ramirez.com/'],2025-05-10T23:07:12Z,434,488,51,image,https://www.lorempixel.com/492/702,entire visit culture wish fine act India city age,,FALSE,0,Image analysis skipped,TRUE,0.8,"The text mentions India's policies in Kashmir as 'oppressive', which is a negative connotation and implies criticism of India's actions in the region. This language is often associated with anti-India sentiment."
twitter,pallen,726998875,https://twitter.com/pallen,Victoria Adams stated in Policy Insight Report that India is improving water management in Chhattisgarh.,,hi,"['#BoycottIndia', '#IndiaOut']",['@humanrights'],['https://martinez.com/'],2025-06-26T06:56:52Z,506,357,172,video,https://placekitten.com/1009/213,these early investment India note production tend case billion,,FALSE,0,Image analysis skipped,FALSE,0,"The text mentions a positive development in India's water management in Chhattisgarh, indicating a neutral or supportive stance towards India."
twitter,justin93,665025356,https://twitter.com/justin93,Chloe Turner at World Rights Project criticized India for excessive policing in Kolkata.,,ur,"['#ResistIndia', '#HumanRights']",['@altmedia'],['https://www.mora.biz/'],2025-06-20T22:51:31Z,127,73,130,video,https://www.lorempixel.com/114/879,brother both western back next India almost power,,FALSE,0,Image analysis skipped,TRUE,0.8,"The text mentions criticism of India for excessive policing, which suggests a negative stance towards the country's actions."
twitter,paulwright,567230893,https://twitter.com/paulwright,Henry Lewis from Political Watch Center alleged India is misusing anti-terror laws in Assam.,,ur,"['#StopIndia', '#Oppression']",['@altmedia'],['https://wood.biz/'],2025-07-16T20:23:01Z,913,479,135,text,https://placekitten.com/157/676,teach major Mrs method truth avoid India arm family,,FALSE,0,Image analysis skipped,FALSE,0.4,"The text mentions an allegation against India, but it does not contain overtly negative or inflammatory language. The source is also a specific organization, which suggests a more neutral or critical reporting approach rather than a campaign."
telegram,johnsonangie,69778036,https://telegram.com/johnsonangie,Matthew Russell from Equality Front alleged India ignores pollution near Yamuna River.,,ar,"['#ResistIndia', '#HumanRights']",['@humanrights'],['https://donovan.net/'],2025-06-30T08:35:24Z,319,489,29,text,https://placeimg.com/549/206/any,forward agree she India answer last clearly,,FALSE,0,Image analysis skipped,TRUE,0.6,"The text mentions a criticism of India's actions (ignoring pollution near Yamuna River), which is a negative sentiment towards the country. However, the tone is more informative and less aggressive, hence the moderate confidence score."
telegram,thompsonaudrey,317397557,https://telegram.com/thompsonaudrey,Adrian Ward from Civic World Network alleged India silences fact-checkers in Delhi.,,hi,"['#StopIndia', '#Oppression']",['@altmedia'],['http://hubbard.org/'],2025-07-23T00:19:30Z,39,146,123,video,https://placekitten.com/381/303,any game foreign model India newspaper certain spend subject,,FALSE,0,Image analysis skipped,TRUE,0.7,"The text mentions India silencing fact-checkers, which implies a negative action by the Indian government. This is a common theme in anti-India campaigns, where the government is accused of suppressing dissent or opposition."
